{
  "version": 1,
  "fallback": "en",
  "brands": {
    "note": "Which brand mark a row shows. Every id names a vendored lockup in packages/assets/src/icons/combine/; scripts/build.mjs fails the build on an id that is not there. This is presentation data, kept out of the bundle like the rest of this document, and it is separate from the copy rules above: a vendor's mark and a vendor's description line change for different reasons. `providers` is deliberately empty: a model no rule claims draws **no** lockup rather than its provider's, because the reseller's own lockup on a model it did not make reads as a wrong answer rather than a missing one. `models` is an ordered, anchored rule list resolved against the model's id and then its display name (D79), exactly like `families` and with the same discipline: first match wins, so a broad rule must sit below the narrow ones and every rule must name its vendor (`step` cannot match `step-3.7-flash` by accident only if no earlier rule already claimed it). A brand with no lockup renders the label without a mark.",
    "providers": {},
    "models": [
      { "match": "deepseek", "brand": "deepseek" },
      {
        "match": "claude",
        "brand": "claude",
        "note": "Claude rows draw Claude's own lockup, not the parent Anthropic one: the label names the model line, and a wordmark has to match the word it stands in for — the same reason Grok rows draw Grok's rather than xAI's. Anthropic stays the fallback for the `anthropic` route."
      },
      { "match": "gpt|(^|[^a-z0-9])o[1-9](-|$)", "brand": "openai" },
      {
        "match": "nano-?banana",
        "brand": "nanobanana",
        "note": "Nano Banana is a Gemini image model with its own identity in the catalog, so it draws its own lockup rather than the Gemini one."
      },
      {
        "match": "gemma",
        "brand": "gemma",
        "note": "Gemma is Google's open model line, so it draws its own lockup rather than the parent Google one — the same reason Claude and Grok do."
      },
      {
        "match": "gemini",
        "brand": "gemini",
        "note": "A Gemini row shows the model line's mark; the provider group header above it shows Google's, because providers resolve from `providers` and never from here."
      },
      { "match": "glm", "brand": "zai" },
      {
        "match": "kimi|(^|[^a-z0-9])k3($|-)",
        "brand": "kimi",
        "note": "The id can carry the serving provider's namespace (`cn:k3`, `moonshot/k3`), so the segment start accepts any character outside a letter or a digit. Requiring `k3` to start a segment is what leaves `mk3` unclaimed."
      },
      { "match": "qwen", "brand": "qwen" },
      { "match": "step", "brand": "stepfun" },
      {
        "match": "minimax|(^|[^a-z0-9])m[23]($|-)",
        "brand": "minimax",
        "note": "The id can carry the serving provider's namespace (`cn:m3`), so the segment start accepts any character outside a letter or a digit. Requiring `m2` or `m3` to start a segment is what leaves `pm2` unclaimed."
      },
      { "match": "muse-spark|llama", "brand": "meta" },
      { "match": "celeris", "brand": "celestoai" },
      { "match": "mercury|inception", "brand": "inception" },
      {
        "match": "grok",
        "brand": "grok",
        "note": "Grok is the model line, xAI the company: a Grok row shows Grok's own mark, while the provider group header above it still shows xAI's, because providers resolve from `providers` and never from here."
      },
      { "match": "doubao|seed|volc", "brand": "bytedance" },
      { "match": "ernie", "brand": "baidu" },
      {
        "match": "hunyuan|(^|[^a-z0-9])hy(\\d|-?mt)",
        "brand": "tencent",
        "note": "The id can carry the serving provider's namespace (`cn:hy3`, `openrouter/hy3`), so the segment start accepts any character outside a letter or a digit. Requiring `hy` to start a segment is what leaves `shy-mt2` unclaimed."
      },
      { "match": "mistral|magistral|codestral", "brand": "mistral" },
      { "match": "north|command-?[ar]|cohere", "brand": "cohere" },
      { "match": "phi-?\\d", "brand": "microsoft" },
      {
        "match": "(^|[^a-z0-9])nova(-|$)",
        "brand": "nova",
        "note": "The vendor name has to start a segment and end one: unanchored, this rule claims `sensenova-6.8-flash-lite` for Amazon and lands that lockup in the middle of the name."
      },
      { "match": "mimo", "brand": "xiaomimimo" },
      { "match": "longcat", "brand": "longcat" },
      { "match": "sonar|perplexity", "brand": "perplexity" },
      {
        "match": "beam",
        "brand": "reflection",
        "note": "Beam is Reflection's own line, so its rows draw the vendor's lockup — whose word is the vendor's, and the catalog's own name never spells it (`Beam Free · OpenCode Go`), so the label leads with the lockup instead of replacing a word in it."
      }
    ],
    "lockups": {
      "note": "Per-brand overrides for the vendored lockup, applied by scripts/fetch-lobe-combines.py. `word` is the word the lockup stands in for inside a model name (it must match how the catalog spells it, which is not always Lobe's TITLE), `mark` and `text` name the Lobe icons the two halves are taken from (so a model line can wear its own mark with its parent's wordmark), `keep` crops a wordmark to a fraction of its ink width (GLM-V's \"-V\" is not part of the name), and `tint` is the brand colour a hand-provided mark wears on the ivory canvas, where a fetched mark carries Lobe's own.",
      "meta": { "word": "Meta", "lockup": true },
      "openai": { "word": "GPT", "local": "openai.svg", "textFrom": 0.529 },
      "tencent": { "word": "Hunyuan", "mark": "hunyuan", "text": "tencent" },
      "stepfun": { "word": "Step", "mark": "stepfun", "text": "stepfun" },
      "xiaomimimo": { "word": "MiMo", "mark": "xiaomimimo", "text": "xiaomimimo" },
      "nanobanana": { "word": "Nano Banana" },
      "zai": { "word": "GLM", "mark": "zai", "text": "glmv", "keep": 0.62 },
      "reflection": { "word": "Reflection", "tint": "#1e3207" }
    }
  },
  "families": [
    {
      "match": "deepseek.*flash",
      "text": {
        "zh": "非对称模型结构，小成本大智能。",
        "en": "Asymmetric architecture: more intelligence, less cost."
      },
      "note": "Every DeepSeek Flash reads the same line: the copy describes the line, not a version, so a retired Flash and a future one say the same thing. Anchored on `deepseek` on purpose: an unanchored /flash$/ would hand this copy to glm-5.3-flash, step-3.7-flash and every other vendor's flash tier."
    },
    {
      "match": "deepseek.*pro",
      "note": "The Pro line's own official heading on the V4 preview page. No rule pins it to a version: a Pro is a Pro whatever its version.",
      "text": {
        "zh": "性能比肩顶级闭源模型。",
        "en": "Performance rivaling the world's top closed-source models."
      }
    },
    {
      "match": "deepseek",
      "note": "Everything else in the line — V3.2, R1, and whatever comes next — shares the V4.1 release title.",
      "text": {
        "zh": "更强、更快、更普惠。",
        "en": "Smarter, faster, more affordable."
      }
    },

    {
      "match": "claude.*fable",
      "note": "Fable is a model line of its own (Mythos / Fable / Opus / Sonnet / Haiku), so it must not fall through to the generic Claude rule. Its copy is the line tagline from anthropic.com/claude/fable, and it carries no tier prefix of ours.",
      "text": {
        "zh": "新一代智能，专为解决最艰深的知识工作和编程难题。",
        "en": "Next generation of intelligence for the hardest knowledge work and coding problems."
      }
    },
    {
      "match": "claude.*mythos",
      "note": "Mythos is Fable's unrestricted sibling — Anthropic's own words: Fable is the same underlying model with cybersecurity and biology safeguards added. Access to Mythos is limited to vetted organizations, so its copy leads with the audience rather than the capability.",
      "text": {
        "zh": "面向网络安全与生物学研究的可靠模型。",
        "en": "Built for cybersecurity and biology research, with access limited to vetted organizations."
      }
    },
    {
      "match": "claude.*opus",
      "note": "Family copy stays version-agnostic, so it carries no superlatives: 'strongest' is only true of the current generation and would mislabel an older Opus. Superlatives belong in a rule anchored to the version. It also carries no tier prefix of ours — '旗舰档：' is our positioning, not the model's own line.",
      "text": {
        "zh": "面向复杂编程与 AI 智能体的混合推理模型。",
        "en": "A hybrid reasoning model built for serious coding and AI agents."
      }
    },
    {
      "match": "claude.*sonnet",
      "text": {
        "zh": "面向实时智能体与高吞吐的混合推理模型。",
        "en": "Hybrid reasoning for real-time agents and high-volume work."
      }
    },
    {
      "match": "claude.*haiku",
      "text": {
        "zh": "面向速度敏感的高吞吐场景，响应快、成本低。",
        "en": "For speed-sensitive, high-volume workloads at low cost."
      }
    },
    {
      "match": "claude",
      "text": { "zh": "Anthropic Claude 模型。", "en": "Anthropic Claude model." }
    },

    {
      "match": "codex",
      "text": {
        "zh": "为 Codex 智能体编程优化，可并行处理多项软件工程任务。",
        "en": "Optimized for agentic coding in Codex, handling several software tasks in parallel."
      }
    },
    {
      "match": "gpt[._-]?5[._-]?4(?!\\d)",
      "note": "Anchored to the 5.4 generation: the context size and the computer use are that model's, so a later GPT-5 reads the rule below.",
      "text": {
        "zh": "面向编程与专业工作的长上下文模型。",
        "en": "For coding and professional work, with a 1.05M-token context and native computer use."
      }
    },
    {
      "match": "gpt-?5",
      "text": {
        "zh": "内置思考、可配置推理强度，面向编程与智能体任务。",
        "en": "Thinking built in with configurable reasoning effort, for coding and agentic tasks."
      }
    },
    {
      "match": "(^|[/-])o[1-9](-|$)",
      "text": {
        "zh": "作答前深入思考，从 o1 到 o3 与 o4-mini。",